Page type,Content template,URL example,Search intent,Target keywords,Primary internal links (user-first order)
Homepage,Site gateway,https://tourism-tickets.com/,Orient the traveler to next planning step: pick a destination region/country/city browse itineraries or practical guides without committing to one URL depth yet.,trip planner website; vacation planning guide; travel itinerary ideas; where to go on holiday,"→ Destinations (CLP); → Region PLP examples (e.g. Europe); → Country PLP examples (e.g. Spain); → Itineraries (CLP); → Travel guides (CLP); → About us (trust)."
About us,Institutional trust,https://tourism-tickets.com/about-us/,Confirm who publishes the guides how destinations are chosen and how to contact the team before trusting itinerary advice.,about tourism tickets; editorial guidelines travel site; contact tourism guides,"→ Homepage; → Travel guides (CLP) for methodology references if relevant."
Destinations (CLP),Destination directory,https://tourism-tickets.com/destinations/,Compare countries and macro-regions at once and drill down toward one Region PLP or Country PLP.,best holiday destinations; countries to visit; where to travel next,"→ Selected Region PLPs (e.g. Europe); → Selected Country PLPs (e.g. Spain, Italy); → Itineraries (CLP); → Travel guides (CLP)."
Region (PLP),Region destination hub,https://tourism-tickets.com/europe/,Short-list trip styles across multiple countries within one geography then jump into a Country PLP or a Region-scoped itinerary.,europe holidays; europe trip planning; city breaks europe,"→ Country PLPs inside region (e.g. Spain France Italy); → Region Itineraries PLP if published (/itineraries/europe/); → Region-scoped Itineraries PDPs (e.g. Scandinavia multi-country); → Travel guides PLP for region if used (/travel-guides/europe/)."
Country (PLP),Country destination hub,https://tourism-tickets.com/spain/,Validate Spain as the trip container scan regions cities seasons and typical lengths before opening city-level detail.,best places to visit in spain; spain travel guide; tourist places in spain,"→ Priority City PDPs in Spain (e.g. Barcelona Madrid Seville); → Country Itineraries PLP (/itineraries/spain/); → Country-scoped Itineraries PDP (e.g. Spain 7 days); → Travel guides PLP for Spain (/travel-guides/spain/)."
City (PDP),City destination pillar,https://tourism-tickets.com/spain/barcelona/,Understand Barcelona neighborhoods signature sights transport seasons day-trip hooks then dive into day-by-day only via matching scope.,things to do in barcelona; barcelona travel tips; best time to visit barcelona; how many days in barcelona,"→ Same-city Itineraries PDP first when exists (/itineraries/barcelona-3-days/); → Spain Itineraries PLP (/itineraries/spain/) for broader routes that include Barcelona; → Spain Country PLP (/spain/); → Peer City PDPs (e.g. /spain/madrid/) under same country; → Spain Travel guides PLP (/travel-guides/spain/) for thematic articles (budget seasons)."
Itineraries (CLP),Itinerary hub directory,https://tourism-tickets.com/itineraries/,Pick itinerary scope before geography drill-down Region PLP Country PLP or search PDP by duration archetype.,trip itinerary builder ideas; multi-city vacation routes; road trip itinerary examples,"→ Itineraries PLP Region examples; → Itineraries PLP Country examples (Spain Italy); → Featured PDPs by scope (region country city)."
Itineraries (PLP),Region itinerary index,https://tourism-tickets.com/itineraries/europe/,Browse multi-country route templates for Europe only open PDPs whose slug/geo matches European scope.,europe trip itinerary; backpacking europe route; multi-country europe vacation,"→ Region Itineraries PDP rows only (e.g. Scandinavia 10 days); → Region PLP (/europe/) for context; → Country Itineraries PLPs when route narrows to one country."
Itineraries (PLP),Country itinerary index,https://tourism-tickets.com/itineraries/spain/,Browse Spain-only timed routes compare durations and entry cities link only to Spain-scoped PDPs or Spain-centric legs.,spain itinerary 7 days; spain road trip itinerary; one week in spain,"→ Spain Country PLP (/spain/); → Country Itineraries PDP (e.g. /itineraries/spain-7-days/); → City PDP anchors used in route (Barcelona Madrid); → Spain Travel guides PLP for logistics topics."
Itineraries (PDP),Region multi-stop route (ordered legs),https://tourism-tickets.com/itineraries/scandinavia-10-days/,Follow an ordered multi-country Nordic route with legs pacing and cross-border transport emphasis not city-only pacing.,scandinavia itinerary 10 days; nordic countries trip planner; scandinavia ring route,"→ Region PLP when exists for Scandinavia or Europe parent; → Country PLPs visited (Norway Sweden Denmark Finland as applicable); → City PDPs only for overnight bases named in H1; → Region Travel guides PLP if published."
Itineraries (PDP),Country multi-city route (ordered legs),https://tourism-tickets.com/itineraries/spain-7-days/,Execute a Spain-only loop or corridor day-by-day or staged segments linking each stop to its City PDP for local depth.,spain itinerary one week; 7 days in spain route; spain multi-city trip,"→ Spain Country PLP (/spain/); → Each City PDP on route (e.g. Barcelona Madrid); → Spain Itineraries PLP (/itineraries/spain/) for sibling durations; → Spain Travel guides PLP for seasonal or budget context."
Itineraries (PDP),City day-by-day route,https://tourism-tickets.com/itineraries/barcelona-3-days/,Lock hourly pacing for Barcelona only meals clusters and neighborhood flow defer encyclopedic city context to City PDP.,barcelona 3 day itinerary; weekend in barcelona plan; three days barcelona schedule,"→ Barcelona City PDP (/spain/barcelona/) for sights context maps FAQs; → Spain Itineraries PLP (/itineraries/spain/) to upsell wider Spain routes; → Spain Country PLP (/spain/) when visitor expands trip."
Travel guides (CLP),Guide topic directory,https://tourism-tickets.com/travel-guides/,Find thematic answers budgeting packing insurance health planning before picking a geography hub.,travel tips international trips; budget travel checklist; how to plan a vacation,"→ Travel guides PLP per geo used (e.g. Spain Europe); → Homepage destinations shortcuts."
Travel guides (PLP),Geo-filtered article index (country),https://tourism-tickets.com/travel-guides/spain/,Discover Spain-specific articles budgeting seasons transport norms without day-by-day calendars competing itineraries hub.,spain travel tips; budget travel spain; best time to visit spain,"→ Spain Country PLP (/spain/); → Spain Itineraries PLP (/itineraries/spain/) when reader pivots to schedules; → Featured Travel guides PDP rows under Spain geo only."
Travel guides (PDP),Thematic article (single intent),https://tourism-tickets.com/travel-guides/spain/best-time-to-visit-barcelona/,Resolve Barcelona timing weather crowds trade-offs linking outward only to Barcelona City PDP and Spain hubs not unrelated cities.,best time to visit barcelona; barcelona weather by month; barcelona crowds peak season,"→ Barcelona City PDP (/spain/barcelona/); → Barcelona City Itineraries PDP if exists; → Spain Travel guides PLP index; → Spain Country PLP (/spain/)."
